OUTLET,TITLE,DATE,URL,TEXT
NYT,Readers Respond to the 5.20.18 Issue,31-May-18,https://www.nytimes.com/2018/05/31/magazine/readers-respond-to-the-5-20-18-issue.html?searchResultPosition=17,"RE: MACHINE MEDICINE

Abraham Verghese wrote about the threat that the transition to electronic health records poses to physicians' clinical judgment.

Abraham Verghese's article eloquently describes the debacle of the mass and hasty implementation of electronic health-record technology that occurred in response to the American Recovery and Reinvestment Act of 2009. The health-information-technology industry certainly bears the responsibility for producing and deploying a vast amount of software that was far from ready for prime time.

Whereas Verghese's article offered little hope that the tech can offer a remedy to what ails the health system, I actually believe that the rule ''you break it, you own it'' sheds light on a path forward. Leading companies in this industry have acknowledged that we broke it and that we therefore own it and are determined to fix it. As a result, significant efforts are underway to improve E.H.R. usability and reduce physician burnout by incorporating advanced machine-learning capabilities to anticipate and predict documentation and intervention sequences. Interoperability, maligned in Verghese's article, is actually allowing data to be shared across health systems, enhancing safety and quality. Big-data analytics are transforming the way physicians care for populations of patients. The industry has better days ahead. We broke it, we own it. Dr. Betty Rabinowitz, chief medical officer of NextGen Healthcare

I'm a millennial who's old enough to remember paper carbon-copy orders that we, as students, would file at the nurses' station, yet young enough to have used electronic health records since my intern year. Despite their shortcomings, I still find that E.H.R.s provide a great boon to the overall work flow. An E.H.R. progress note full of pre-populated text is absolutely dreadful to read. But to paraphrase a mentor of mine: ''It's like you guys were given a Cadillac and you don't know how to use it.''

I type my notes as if I'm writing by hand. It's my responsibility, not a program's, to make sure what's in my note is accurate. E.H.R.s can be programmed to shame those who copy and paste: Pasted text is clearly marked on a new note. Everyone can see that the writer copied it. Upcoding is easier with E.H.R.s, and thus more annoying to providers. But upcoding is not inherent to E.H.R.s. That's on your boss and the payor. The electronic interoperability between hospitals for medical records is dependent on ease of consent and the hospitals' lawyers and their interpretation of privacy laws. The function is there, and I have used it on the rare occasion when it works. Grant Lee, St. Cloud, Minn.

RE: TRIP DOCTORS

Michael Pollan wrote about the use of therapeutic psychedelic drugs.

While Michael Pollan survived the dissolution of his ego defenses after ingesting psilocybin, other people with mental illness or difficulty coping with life may not be so lucky. The frightening drug-induced psychosis he describes could overwhelm remaining constraints keeping someone from violence or suicide. The fascination with psychedelic drugs, psychosurgery, brain-stimulation devices, intravenous infusions, etc., is symptomatic of the current mental health crisis.

Mental health care begins with a thorough evaluation to identify causes of illness whether socioeconomic, psychological or biological. Once properly diagnosed, a majority of people can benefit from proven effective and safe interventions that may include psychotherapy or medications. The dangers of guided psychedelic ''journeys'' include not only adverse drug-reactions but also discouraging people from seeking effective care and promoting drug abuse. The real problems in mental health care are continuing stigma, misinformation and barriers to availability, access and affordability of established therapies. Stanley N. Caroff, professor of psychiatry, Perelman School of Medicine, University of Pennsylvania

Michael Pollan is clarifying what those of us who have used many types of illicit drugs have known: There are bad drugs and there are good drugs. As a 25-year-old college student, I was heavily addicted to alcohol and opiates. Luckily, I encountered psilocybin, and after several difficult but enlightening trips, I gave up alcohol and pills for good. I am now 33, married and the mother of two children, leading a sober life. The psilocybin awakened my spirit. There are many others who have had this experience ''underground.'' The psychedelics work. Let's hope this research can continue because this could be an answer to the opioid crisis, not to mention the spiritual malaise that is so prevalent in my generation. Lauren Heeren, DeLand, Fla."
NYT,Jon Hopkins’s Psychedelic Journey to a New Way of Creating Music,10-Nov-21,https://www.nytimes.com/2021/11/10/arts/music/jon-hopkins-music-for-psychedelic-therapy.html?searchResultPosition=19,"For more than a decade, the British producer’s muscle and grace made him a festival favorite. His new album, “Music for Psychedelic Therapy,” takes an unexpectedly quiet turn.

When Jon Hopkins was bullied as a London teenager, he found two complementary coping mechanisms: weed and ambient music.

A little sullen and shy, Hopkins was a contest-winning classical pianist who also adored the ineffable mystery of electronic pop production, huddling near the stereo to wonder how exactly Depeche Mode or Abba worked. Just as he started to approximate some of those sounds, his world faltered. Old friends at his all-boys school became enemies. His parents split. He would retire to his room, get stoned, lie down and enter a new dimension, alone inside headphones.

“I would disappear into other realms, hiding in this kaleidoscopic world of magic,” Hopkins, 42, said in a phone interview, announcing that he was lying on a gray couch in the dim recording studio attached to his East London home. “For years, I looked down on that period because I thought I was just escaping, too sensitive to deal with life. But I was learning. That was the formation of everything.”

Shaken by his weed habit and concomitant isolation (both short-lived), Hopkins didn’t take another drug for a decade. But 15 years ago, a psilocybin trip on a remote Scottish shore revealed new wonder with the world, sparking an interest in the benefits of altered states so profound that Hopkins will release a new album called “Music for Psychedelic Therapy” on Friday.

A 64-minute rhythmless expanse of delicate electronics, immersive natural sounds and celestial choirs, it is meant to soundtrack a ketamine trip or, more broadly, guide listeners toward their own “other realms.” After more than a decade as a feted producer for artists including Coldplay and Purity Ring — and three lauded LPs and an array of smaller projects since 2009 of his own — Hopkins has gone quieter, in an ambient way.

“There’s no way the extraordinary beauty of these moments cannot enhance your life,” Hopkins said of that seaside morning that changed his trajectory, and a more recent odyssey amid the Mojave’s Joshua trees. “I’m not advocating for people doing these things, but, for me, they keep the wonder of being alive present.” (Medical experts recommend using psilocybin or ketamine only with a doctor’s prescription, and warn of risks associated with their casual use.)

“When you live in a city, you can forget how extraordinary it is that anything exists at all,” he added.

It is fitting that “Music for Psychedelic Therapy” began taking shape in an uncomfortable way for Hopkins — by descending 200 feet beneath the Ecuadorean rain forest into a cave teeming with scorpions, tarantulas and bats, his neighbors for four days and three nights.

At a summer festival in 2017, the musician met Eileen Hall, the daughter of a Scottish civil engineer who led a gold-seeking expedition into Cueva de los Tayos in the 1970s that prompted the identification of several hundred species and an ongoing campaign to secure UNESCO World Heritage status. A painter fascinated by the intersection of psychedelics and spirituality, Hall hoped to build on her father’s legacy through artistic residencies that found new ways to express existence underground.

She expected Hopkins to pass politely on her 2018 invitation, as he prepared for a spree of tours behind “Singularity,” the album he released months before the planned trek. “It’s a nuts thing,” Hall said by phone, laughing, “to go into a massive hole in the ground in the middle of nowhere in a country he’d never been to with people he didn’t know.”

But Hopkins immediately said yes, telling his management to mark it as vacation. He flew to Ecuador’s capital, Quito, in a haze induced by two sleepless nights of partying at an enormous festival he headlined. His instinct made instant sense.

“The part of my brain looking for something to fix or worry about quieted down,” Hopkins said. A practitioner of Transcendental Meditation and the breathing ideas of the Dutch endurance athlete Wim Hof, Hopkins felt as if he disappeared into the earth itself while perched on a rock inside a cathedral-size chamber. “There were some moments of actual silence in my head.”

As Hopkins’s peers snapped photographs, made films and captured the Tayos soundscape, he relished in the mission’s most laissez-faire charge: to absorb his surroundings and, someday, translate them into music. He presumed the 20-minute collage he recorded — a flow state of ecstatic bird song and rushing water captured underground, undergirded by seraphic drones — would be a stand-alone release. But then, a 1975 talk by the hallucinogenic mystic Ram Dass at a Unitarian church in Massachusetts arrived in his inbox.

[Video: Watch on YouTube.]

Trevor Oswalt, an artist who records psychoactive soundtracks sporting names like “Music for Mushrooms” and “Spores” as East Forest, had also become a new friend. Years earlier, Oswalt had visited Dass in Maui, recording conversations he turned into a winsome collection of inspirational tunes. When Dass died in late 2019, his foundation, Love Remember Serve, dispatched a clutch of archival lectures to Oswalt, who came to Hopkins for help.

Oswalt had already stripped the two-hour reel of overt religious content, creating a 15-minute edit. “We wanted something universal and uplifting, that’s hard to argue with,” Oswalt said in a video interview from his studio, a painting of Dass peering over his shoulder.

In October 2020, Hopkins sat at the polished upright piano in the corner of his own studio, improvising to his first impressions of Dass’s words. “Quiet the mind. Open the heart,” Dass encouraged in a voice as calming as a cup of chamomile. This, Hopkins realized, was an album’s end; the music he’d found in Ecuadorean silence was its beginning.

“I always know when the spark of something has appeared,” he said. “That is one of the best feelings, when you know something is going to be important.”

Hopkins spent the next four months of lockdown searching for tones to fill the frame, finding the right sounds serendipitously — in a beer glass he tapped, and the noise from a software fail. He shipped tracks to Dan Kijowski, a childhood friend with whom he had shared several psychedelic trips, and Kijowski broadcast them through eight speakers suspended in trees around his family farm, recording the playback. Hopkins wove the results into the album, repeatedly listening from his studio’s couch until he knew this was his paragon of music for psychedelic therapy.

“On previous records, I’d been aware I wanted them to do well commercially, that I needed a big track,” Hopkins said, frowning beneath the thin beard that framed his patrician face. “This was an opportunity to drop every level of pretense. I was just trying to translate the honest experience of living.”

The album feels so personal that Hopkins doesn’t know if, when or how he will perform it live, a potential violation of its sacred intimacy. The record is instead being played at a series of small listening events through powerful speakers, like a ritualistic sound bath. Hopkins attended the September premiere in Texas, watching as a few hundred people sprawled on the floor, as he did as a bullied teenager. Some cried. Others chanted.

Hopkins hadn’t anticipated how vulnerable the experience would feel. “Oh my God, what have you done? You’ve revealed everything,” he thought to himself, made anxious by his own prescription. Oswalt remembered Hopkins pacing the floor and fiddling with earplugs, as if working through preperformance jitters. But when “Sit Around the Fire,” the Dass-narrated finale, began, Hopkins climbed onstage to improvise an alternate grand-piano ending. He was cured.

“It’s an analogy for my life, really: I can sit there in an anxious state, overthinking things,” he said, chuckling nervously. “Then I go play, and it all makes sense again.”"
NYT,"In the Pandemic, a Shifting Ballot Debate on Legalizing Drugs",26-Oct-20,https://www.nytimes.com/2020/10/26/us/drug-marijuana-legalization-ballot-measures.html?searchResultPosition=24,"Marijuana measures are on the ballot in several states that once resisted them. Oregon would go further with a proposal to decriminalize drugs like heroin, cocaine and methamphetamine.

Oregon has an addiction problem. Pockets of rural poverty, chronic homelessness and cities with lots of young people have given the state one of the highest rates of substance abuse in the nation. It is also, because there is so little money allocated to it, one of the toughest places to get treatment.

A proposed solution on the ballot next week would be one of the most radical drug-law overhauls in the nation’s history, eliminating criminal penalties entirely for personal use amounts of drugs such as heroin, methamphetamine and cocaine. Tax revenues from drug sales would be channeled toward drug treatment.

Supporters of the Oregon proposal, Measure 110, say the swirling, transformational forces of 2020 — the coronavirus pandemic, as well as the wave of social unrest over race, policing and incarceration — have highlighted a need for top-to-bottom change. Opponents say decriminalization courts disaster by normalizing drugs that carry the risk of deadly addiction.

Oregon is far from alone in stepping out onto new terrain. Legal marijuana, stalled for years in politically conservative states even as more left-leaning areas plowed ahead, has found a place on the ballot this year in Arizona, Mississippi, Montana and South Dakota. National groups that have long dreamed of a federal overhaul of drug laws say that success in those states could bring Republican elected officials into Congress with constituents who have said yes to legalization, potentially tipping the balance in Washington.

Money is an undercurrent everywhere, as many state budgets face big shortfalls as a result of the drop-off in consumer spending during the pandemic, forcing a search for alternative tax sources.

“The pandemic has only highlighted and intensified the need for new options,” said Sam Chapman, the campaign manager for Yes on 109, a separate drug measure on the ballot in Oregon that would make psilocybin, the psychoactive ingredient in magic mushrooms, legal for mental health treatment. Voters in Washington, D.C., will decide in a ballot measure there whether to make possession of fungi-based psychedelics the lowest level of police priority, but Oregon would be the first with a statewide treatment policy. “We all know someone who is suffering,” Mr. Chapman said.

Dave Lewis, a Republican who served in the Montana Legislature and as state budget director under three governors over a 42-year public career, framed the argument for legal recreational marijuana in his state as the counterpunch in a fight Montana needs to win.

“This Covid thing is kicking our butts,” said Mr. Lewis, 78, who is advising the group backing recreational marijuana legalization, though he is not, he said, a consumer himself or much interested in becoming one.

Mr. Lewis said that a sharp decline in visitors, as people have been locked down at home around the country, has hit Montana’s outdoor tourist economy hard; marijuana legalization could contribute 4,000 or 5,000 new jobs, according to an analysis by the University of Montana. “That’s huge in Montana — my goodness gracious, we’re like 44th in family income,” he said.

Half the tax revenue from the Montana measure is pledged to public lands and outdoor recreation — an estimated $18 million a year — which has brought in powerful new political allies, including the Montana Wildlife Federation and the Trust for Public Lands, both of which have signed on as supporters.

In New Jersey, which is bracing for an 18 percent decline in tax revenues next year, the drug debate is framed around the police and police budgets. Gov. Phil Murphy, a Democrat, is backing a recreational marijuana measure on the ballot, telling voters that saying yes to legalization would save tens of millions of dollars and allow police officers to focus on more serious public safety threats.

In South Dakota, where voters will decide on medical marijuana and recreational sales in two separate ballot measures, a key pitch is a plan to allocate half of the revenues from recreational marijuana taxes to public schools.

“People know the government needs money, and the schools definitely need money,” said Drey Samuelson, the political director of South Dakotans for Better Marijuana Laws, the group that sponsored legalization.

Opponents of drug legalization argue that the need to find new revenues during the pandemic may be leading people to grasp at straws — and leaving them prone to being manipulated and misled.

In Mississippi, the Legislature has inserted itself into the debate over a measure to legalize medical marijuana. Lawmakers put a separate measure of their own on the ballot that would give them the power to decide how any legalization is put into place.

In Nebraska, where a medical marijuana measure qualified for the ballot, an antidrug group sued and the State Supreme Court last month struck it from the ballot. In South Dakota, opposition has been led by the state’s Chamber of Commerce, which argues that highway and worker safety will suffer.

Opponents to the hard-drug decriminalization measure in Oregon say it would lead to more addiction both by making drugs easier to get and also by removing law enforcement and the courts from the equation.

Currently, many people arrested with small amounts of opiates or other drugs are offered a way out of criminal prosecution through a diversion into treatment and counseling. But without a judge forcing the issue, opponents said, many people will not face up to an addiction problem.

“The sad reality is that many, many people will never seek treatment without the motivation of criminal charges,” said Paige Clarkson, a prosecutor in Marion County, Ore., and the president of the Oregon District Attorneys Association.

The American Psychiatric Association and the Oregon Psychiatric Physicians Association both oppose the state’s psilocybin proposal because they say that while the drug has indeed shown medical promise — the federal Food and Drug Administration last year called psilocybin a potential “breakthrough therapy” for treating major depression — the measure’s proponents are going too far by saying it might help everything from anxiety disorders to addiction.

Across the country, backers of these new drug measures say that the old ways simply have not worked, and that the pandemic has made everything worse. Covid-19 outbreaks in jails and a growing awareness of how many people of color have been imprisoned for drug offenses make a potent new argument, supporters said, for thinking another way.

“Voters, and people at large, increasingly understand that now, especially, is not the time to be arresting somebody for drug addiction,” said Peter Zuckerman, the campaign manager for the 110 measure. “Drug addiction is a health issue; it deserves a health response,” he added.

Both sides in Oregon’s decriminalization debate do agree on one thing, though — that the state’s drug problems have gotten worse. A decade ago, according to federal health reports, Oregon was 10th worst in the nation in the proportion of residents with a substance abuse disorder, including alcohol. By 2016-17, in the most recent rankings, it had the fourth-highest rate. At the same time, the percentage of people who needed treatment but were not receiving it rose from ninth to third worst in the nation.

And while some states that already have legalized marijuana have not realized as much in new tax revenue as had been hoped — California, for example, had trouble luring marijuana buyers away from the black market — the pandemic has been good for legal marijuana sales in Oregon.

Demand has soared, up almost 75 percent between March and August of this year, giving the state budget a jolt of tax revenue in the process."
