OUTLET,TITLE,DATE,URL,TEXT
NYT,Denver Votes on Whether to Decriminalize ‘Magic Mushrooms’,07-May-19,https://www.nytimes.com/2019/05/07/us/denver-magic-mushrooms.html?searchResultPosition=9,"Voters in Denver, a city at the forefront of the widening national debate over legalizing marijuana, will decide on Tuesday whether to be the first in the nation to effectively decriminalize another recreational drug: hallucinogenic mushrooms.

The local ballot measure would not quite legalize “magic” mushrooms, the ones that contain psilocybin, a naturally occurring psychedelic compound. State and federal regulations would have to change to accomplish that.

But if it passes, the measure would make the possession, use or cultivation of the mushrooms by people aged 21 or older the lowest-priority crime for law enforcement in the city of Denver and Denver County. Arrests and prosecutions, already fairly rare, could all but disappear.

Adoption of the measure could signal fledgling public acceptance of a mind-altering drug, outlawed nationally for nearly 50 years, that recent research suggests could have beneficial medical uses. A similar effort failed to get on the ballot in California last year, but it could come up again in 2020; Oregon voters may also vote on a comparable measure next year.

Proponents of more lenient criminal enforcement of psilocybin cite studies indicating that the drug can be beneficial for treating depression and anxiety among cancer patients. Other studies have identified potential uses in therapy for alcoholics and people trying to quit smoking, and in treating depression in people who do not have cancer.

“Because psilocybin has such tremendous medical potential, there’s no reason individuals should be criminalized for using something that grows naturally,” said Kevin Matthews, the director of the “Decriminalize Denver” campaign.

Mr. Matthews, 33, credits psilocybin mushrooms with helping pull him out of a major depression that forced him to withdraw from the United States Military Academy at West Point, where he was a cadet for three years in his 20s.

“It really helped me see outside the box of my own life,” Mr. Matthews said of the drug. “It brought me out of the depths of my own internal struggles and despair.”

Dr. Matthew Johnson, an associate professor of psychiatry and behavioral sciences at the Johns Hopkins University School of Medicine, was one of the authors of a study last year recommending that the Food and Drug Administration reclassify the drug to acknowledge its potential medical uses and relatively low potential for abuse.

Psilocybin is not addictive, and “there’s no direct lethal overdose” of the drug on record, Dr. Johnson said.

“But someone can have a dose that’s psychologically challenging,” he warned. “They panic and they wander into traffic and they die. It’s an admittedly low scale, but if that’s your son or daughter who has gotten into a fatal accident, as rare as that it is, that’s very real.”

Researchers who study psilocybin’s effects use a synthetic version of the drug in carefully controlled environments, he said, which is different from someone growing mushrooms and ingesting them at home.

“Decriminalization in general is supported by public health science,” Dr. Johnson said about Denver’s psilocybin ballot measure. “But if this happens, I would hope that the city would be very clear that it’s not endorsing use, and that there are very clear risks.”

The ballot measure, Initiated Ordinance 301, would also establish a panel to review the law’s impact on public health and safety. The polls are scheduled to close at 7 p.m. Mountain time.

Art Way, the Colorado state director for a pro-legalization advocacy group, the Drug Policy Alliance, praised the local effort in Denver to move psilocybin enforcement off the police’s radar. But he cautioned against tackling the issue piecemeal.

“Separating some drugs as good and some as bad will only stand to perpetuate the drug war,” he said.

Arrests in Denver for incidents involving psilocybin have not numbered more than 59 in any of the last three years, and only 11 cases were prosecuted in that time.

Beth McCann, the district attorney in Denver, opposes the ballot measure, according to a spokeswoman, Carolyn A. Tyler.

“We’re still in the very early stages of marijuana legalization, and we are still learning the impact of that substance on our city,” Ms. Tyler said. “And she is not in favor of Denver being the only city that doesn’t enforce the law.”

Mayor Michael Hancock, who is up for re-election in the municipal election on Tuesday, is also against the proposal, his office said, without elaborating on his reasoning. The Denver Police Department declined to take a position.

Mr. Matthews, the leader of the decriminalization campaign, said the initiative had not met with any organized public opposition. His group collected the necessary signatures to get the proposal on Tuesday’s ballot and raised about $45,000, mostly for social media advertising. No polling has been conducted on the measure.

Jeff Hunt, the director of the Centennial Institute, a policy research group at Colorado Christian University, said he thought the measure could pass, since no one systematically campaigned against it — but people might also be wary of deregulating too many drugs at the same time.

He noted that decriminalization was the first step toward legalizing marijuana, and said that proponents of the psilocybin measure, which he opposes, might be trying to travel the same road.

“What we’re seeing is a kind of social libertarianism that is reacting against the war on drugs, and that’s led us to a position where people feel like drugs like marijuana and even psilocybin could be harmless,” Mr. Hunt said. “And that’s deeply harmful.”"
NYT,Denver Voters Support ‘Magic’ Mushrooms,08-May-19,https://www.nytimes.com/2019/05/08/us/denver-magic-mushrooms-decriminalization.html?searchResultPosition=10,"Voters in Denver, a city at the forefront of the widening national debate over legalizing marijuana, have become the first in the nation to effectively decriminalize another recreational drug: hallucinogenic mushrooms.

The local ballot measure did not quite legalize the mushrooms that contain psilocybin, a naturally occurring psychedelic compound. State and federal regulations would have to change to accomplish that.

But the measure made the possession, use or cultivation of the mushrooms by people aged 21 or older the lowest-priority crime for law enforcement in the city of Denver and Denver County. Arrests and prosecutions, already fairly rare, would all but disappear.

Results posted by the city as a “final unofficial” tally late on Wednesday showed the “Yes” vote won by less than 2,000 ballots. The “No” vote had led throughout the day, until the last updated count by elections officials. Alton P. Dillard, the elections spokesman, said the passage appeared safe, but the final results would not be certified until May 16.

“We won!!!!” the group called Decriminalize Denver that had been pushing the measure, said in a jubilant post on Facebook.

Adoption of the measure, by a margin so close that the measure was initially thought to have been rejected, signaled fledgling public acceptance of a mind-altering drug, outlawed nationally for nearly 50 years, that recent research suggests could have beneficial medical uses. A similar effort failed to get on the ballot in California last year, but it could come up again in 2020; Oregon voters may also vote on a comparable measure next year.

“It’s surreal,” said Travis Tyler Fluck, a field organizer for the campaign to pass the measure, suggesting that Denver had a sizable population of “psychedelic constituents.”

“People just don’t see it as a threat,” he added. “Compared to the ‘sinister’ LSD, magic mushrooms are tame.”

Proponents of more lenient criminal enforcement of psilocybin cite studies indicating that the drug can be beneficial for treating depression and anxiety among cancer patients. Other studies have identified potential uses in therapy for alcoholics and people trying to quit smoking, and in treating depression in people who do not have cancer.

“Because psilocybin has such tremendous medical potential, there’s no reason individuals should be criminalized for using something that grows naturally,” said Kevin Matthews, the director of the pro-mushrooms campaign.

Mr. Matthews, 33, credits psilocybin mushrooms with helping pull him out of a major depression that forced him to withdraw from the United States Military Academy at West Point, where he was a cadet for three years in his 20s.

Dr. Matthew Johnson, an associate professor of psychiatry and behavioral sciences at the Johns Hopkins University School of Medicine, was one of the authors of a study last year recommending that the Food and Drug Administration reclassify the drug to acknowledge its potential medical uses and relatively low potential for abuse.

Psilocybin is not addictive, and “there’s no direct lethal overdose” of the drug on record, Dr. Johnson said.

Researchers who study psilocybin’s effects use a synthetic version of the drug in carefully controlled environments, he said, which is different from someone growing mushrooms and ingesting them at home.

The ballot measure, Initiated Ordinance 301, would also establish a panel to review the law’s impact on public health and safety.

In advance of the vote, Art Way, the Colorado state director for a pro-legalization advocacy group, the Drug Policy Alliance, praised the local effort in Denver to move psilocybin enforcement off the police’s radar. But he cautioned against tackling the issue piecemeal.

“Separating some drugs as good and some as bad will only stand to perpetuate the drug war,” he said.

Arrests in Denver for incidents involving psilocybin have not numbered more than 59 in any of the last three years, and only 11 cases were prosecuted in that time.

Beth McCann, the district attorney in Denver, opposed the ballot measure, according to a spokeswoman, Carolyn A. Tyler.

“We’re still in the very early stages of marijuana legalization, and we are still learning the impact of that substance on our city,” Ms. Tyler said. “And she is not in favor of Denver being the only city that doesn’t enforce the law.”

Mayor Michael Hancock was also against the proposal, his office said, without elaborating on his reasoning. The Denver Police Department declined to take a position."
NYT,The Promises and Perils of Psychedelic Health Care,25-Jan-22,https://www.nytimes.com/2022/01/05/well/psychedelic-drugs-mental-health-therapy.html?searchResultPosition=12,"Many recreational drugs known for mind-altering trips are being studied to treat depression, substance use and other disorders. Here’s what you need to know.

Oregon is legalizing mushrooms. Ketamine can be delivered to your home. People are microdosing LSD to treat pandemic-related anxiety and Wall Street is pouring billions into companies that sell mind-altering drugs. It seems like psychedelics — though mostly still illegal — are everywhere.

While the federal government does not recognize a medical use for most of these drugs and says they have potential for abuse, some of the most prominent universities in the world are studying four substances in particular: psilocybin, ketamine, MDMA and LSD. The bulk of available research suggests that these substances hold promise as part of larger treatment plans.

There is also growing evidence that psychedelic drugs operate differently in the brain than addictive drugs, and advocates have been consistently calling for legalization. But psychedelics remain expensive and difficult to gain access to legally, unless you are part of a research study for mental health purposes.

These drugs are not all the same and do come with risks. One quality they share is the ability to create an altered state of consciousness, commonly referred to as a trip. That effect can either provide a sense of perspective — or be downright terrifying.

“You’re not likely to overdose on them, but you can have life-changing negative experiences,” Katharine Neill Harris, a drug policy researcher at Rice University in Texas, said.

To avoid these experiences, while receiving the benefits these drugs can offer, people have started microdosing smaller amounts at regular intervals — but they are often doing so without professional guidance, and some remain uninformed about significant downsides with very little evidence of benefits.

Here’s what researchers are learning about the psychedelic drugs most prominently involved in mental health research.

Psilocybin

As the active chemical in magic mushrooms, or ’shrooms, psilocybin is the most studied of the psychedelic chemicals found in plants and fungi, and it’s the most likely to become an accepted mental health therapy soon. After last year’s legalization in Oregon, entrepreneurs began investing tens of millions in psilocybin research there, and other cities and states are following suit.

Potential mental health uses: Research conducted in the last decade suggests that psilocybin, typically taken in pill form, has the potential to treat substance use disorders, including alcoholism and nicotine addiction, as well as depression.

That research isn’t conclusive yet, said Paul Hutson, a professor at the University of Wisconsin-Madison who studies psilocybin and leads the school’s center for psychedelics research. But he anticipates there will soon be enough evidence for the Food and Drug Administration to approve psilocybin capsules to treat at least some of these disorders — most likely in the next five years or so.

In the meantime, clinical trials of psilocybin for a variety of conditions are taking place across the country, though they can be difficult to find or have long waiting lists. Still, it’s safer, Dr. Hutson said, to try psilocybin as part of a study than on your own or in one of the treatment clinics that have popped up. In these trials, patients attend appointments to prepare for and process their psychedelic trip with a professional in an environment where any side effects can be managed.

What it does: According to users who have participated in trials, a mushroom trip may induce euphoria and an increased awareness of parts of their environment. For instance, solid objects might seem to breathe in and out. A trip can last more than six hours, and some people describe a positive “afterglow” lasting for months.

Risks: Psilocybin can cause distressing hallucinations or feelings of panic and anxiety in some patients, especially at high doses. You can’t be guaranteed safety standards — having a trained professional who can reassure you, protect you and even administer drugs during a bad trip — in therapy outside of a research trial, Dr. Harris said.

One use of psilocybin, which should not be confused with standard treatment described above, is microdosing. By taking small doses — perhaps 10 percentof a standard dose — every few days, some people might experience mental health benefits without the high. But microdosing psilocybin can be harmful, and there is some evidence that it can damage the heart over time. Recent research also suggests that the positive impacts of microdosing in humans may be largely caused by the placebo effect.

Ketamine

First synthesized in 1956, ketamine, sometimes called Special K, is used today as an anesthetic by veterinarians and in emergency or combat medicine. Because it is the one psychedelic that’s never been illegal, researchers have been able to explore ketamine’s potential as a mental health treatment — and build a case for its use in humans.

Potential mental health uses: Many brain disorders — like schizophrenia, depression and anxiety — are characterized by atrophy in the prefrontal cortex. The evidence is strong, though not yet conclusive, that ketamine helps people with psychiatric disorders by promoting regrowth over time in neurons in this area. That could help explain the near-immediate feelings of relief that users report, which is one of the reasons it has been used in the treatment of suicidal patients.

Esketamine, a form of ketamine, showed such promise for treating major depression, often faster than other drugs, that the F.D.A. approved its limited use in early 2019.

What it does: Ketamine can create euphoria and provide a sense of detachment from reality. Users taking a low dose might feel as though they’re floating or that their body is numb. Higher doses can temporarily make people clumsy and forget where they are or even who they are. Blurred vision or hallucinations are common.

Ketamine works differently from other psychedelics. Most psychedelics — like LSD, MDMA and those derived from plants — operate by affecting serotonin receptors, which alter mood and happiness. Ketamine affects a different class of brain receptors that are important for learning and memory. Both kinds of receptors are found in the brain’s prefrontal cortex, which might explain why ketamine and the other psychedelics seem to have similar impacts on mental health.

“The prefrontal cortex is a brain region that’s really critical,” said David Olson, a chemistry professor at University of California, Davis, who studies chemicals that affect brain function. “It talks to a whole bunch of brain regions that regulate things like mood, emotion, fear, reward.”

Risks: Ketamine is also known for a specific and scary side effect nicknamed the “k-hole.” It’s rare in clinical settings, but users may feel disassociated from themselves and their surroundings and panic or feel paranoid.

LSD

“Turn on, tune in, drop out.” “Lucy in the Sky with Diamonds.” Silicon Valley microdosing. Suffice it to say, LSD, also known as acid, has a storied place in American popular culture.

Potential mental health uses: It’s shown promise for treating alcohol addiction and has been studied for other conditions like depression. As with psilocybin, some new LSD adherents microdose to achieve mental health benefits without the trip.

What it does: LSD users have reported feelings of bliss during their trip, being able to see sound and having mystical experiences as well as a sense of closeness with others.

Risks: Some people experience lasting psychological trauma caused by a bad trip, especially when they take higher doses or use LSD often.

Microdosing LSD may have physical risks, too. In a study on rats, microdosing LSD had the opposite effect of a trip; it made the rats display signs of psychiatric illness, like aggression and poor grooming. Similar to microdosing psilocybin, it may also strain the heart by overworking the neurons around the organ.

“If you’re constantly stimulating these neurons, even with a small dose of these compounds, the neurons just can’t take it,” Dr. Olson said.

MDMA

A well-known club drug, also known as ecstasy or molly, MDMA has been researched on and off for decades for potential mental health benefits. While the drug remains illegal, the F.D.A. allows its use in research and treatment for life-threatening illness.

Potential mental health uses: In 2010, results from a study on treatment-resistant PTSD renewed interest in MDMA research. Since then, it has also been explored as a treatment for other conditions like substance use disorder or social anxiety in autistic adults, although it has more potential to cause damage than some other psychedelics.

What it does: MDMA is often known by its street name — ecstasy — from the feeling of euphoria and connectedness it promotes in users.

Risks: MDMA can cause lasting kidney and organ damage as well as heart arrhythmias during a trip, especially in patients with related pre-existing conditions.

***

Psychedelic drugs aren’t simple substances. More time and research will provide answers about their effects on the brain and whether it’s possible to use them for medical treatments. For now, Dr. Hutson cautioned that evidence supports psychedelic treatments only in cases where other forms of treatment haven’t worked.

“They’re not a panacea that everybody is going to respond to,” he said."
